{
  "schemaVersion": "luma-learning-return-package/v1",
  "packageType": "learning-return",
  "video": {
    "episodeId": null,
    "title": "Why do we dream?",
    "publishedDate": "2026-08-07",
    "durationSeconds": 360,
    "sources": [
      { "platform": "youtube", "id": "abc123", "url": "https://www.youtube.com/watch?v=abc123" },
      { "platform": "other", "id": "dream-001", "url": "https://example.com/dream-001" }
    ]
  },
  "transcript": {
    "english": "Dreams are stories our brain tells while we sleep.",
    "chinese": "梦是大脑在睡眠时讲述的故事。",
    "source": "ai-collected"
  },
  "keywords": ["dream", "sleep", "neuron"],
  "highlights": [
    { "language": "en", "type": "key", "quote": "Dreams are stories", "note": "主旨句" }
  ],
  "questionLedger": [
    {
      "questionKey": "meaning-of-dream",
      "label": "dream 的动词用法",
      "kind": "vocabulary",
      "depth": "usage",
      "question": "Does dream work as a verb here?",
      "answerSummary": "Yes, it means to experience images while asleep.",
      "sourceQuote": "Dreams are stories",
      "stage": "transcript-study",
      "status": "resolved"
    }
  ],
  "classification": {
    "primaryTopic": "psychology_health",
    "contentForm": "explainer",
    "subtitleDifficulty": "B1",
    "informationDensity": "medium"
  },
  "attempt": {
    "createdAt": "2026-08-07T01:00:00.000Z",
    "passes": {
      "audioOnly": {
        "completedAt": "2026-08-07T01:05:00.000Z",
        "comprehension": 3,
        "captured": ["topic", "phrases"],
        "fragments": "dream brain sleep"
      },
      "visualNoCaptions": {
        "completedAt": "2026-08-07T01:10:00.000Z",
        "comprehension": 4,
        "visualHelp": "some",
        "confirmed": ["topic", "example"],
        "gistGuess": "Dreams come from the brain"
      },
      "transcriptStudy": {
        "completedAt": "2026-08-07T01:20:00.000Z",
        "reviewConfirmed": true,
        "transcriptCoverage": "complete",
        "replayedWithoutCaptions": true,
        "postReplayComprehension": 5
      }
    },
    "recall": {
      "mode": "written",
      "oralCompleted": false,
      "retelling": "Dreams are brain stories during sleep.",
      "gist": "Dreams are generated by the brain during sleep.",
      "outline": "Brain active during sleep\nStory-like images\nNot fully explained",
      "checks": ["gist", "sequence"],
      "independence": "with-outline",
      "completedAt": "2026-08-07T01:30:00.000Z"
    }
  },
  "aiReports": [],
  "liveReports": [],
  "meta": {
    "generatedBy": "External AI learning session",
    "returnedAt": "2026-08-07T02:00:00.000Z",
    "notes": "字幕由外部 AI 根据用户提供内容整理，导入后需人工核对。"
  }
}
